<?xml version="1.0" encoding="UTF-8"?>
<list xmlns:xsi="http://www.w3.org/2001/XMLSchema-instance" xsi:noNamespaceSchemaLocation="../../xsd/items.xsd">
	<item id="9589" name="Talisman Bracelet Lv. 1" type="Armor">
		<!-- <font color=bbaa88><Base effect></font>. Talisman slots +4. <font color=bbaa88><Compounding></font>. Materials: Talisman Bracelets and packages of the same level. In case of failure, the current level remains the same, but materials disappear. -->
		<set name="icon" val="icon.dimension_bracelet_i00" />
		<set name="default_action" val="EQUIP" />
		<set name="bodypart" val="rbracelet" />
		<set name="immediate_effect" val="true" />
		<set name="material" val="SILVER" />
		<set name="weight" val="150" />
		<set name="price" val="1080000" />
		<set name="commissionItemType" val="BRACELET" />
		<set name="is_sellable" val="false" />
		<skills>
			<skill id="50192" level="1" /> <!-- Talisman Bracelet Lv. 1 -->
		</skills>
	</item>
	<item id="9590" name="Talisman Bracelet Lv. 2" type="Armor">
		<!-- <font color=bbaa88><Base effect></font>. Talisman slots +4. P. Atk. +20. M. Atk. +20. <font color=bbaa88><Compounding></font>. Materials: Talisman Bracelets and packages of the same level. In case of failure, the current level remains the same, but materials disappear. -->
		<set name="icon" val="icon.dimension_bracelet_i01" />
		<set name="default_action" val="EQUIP" />
		<set name="bodypart" val="rbracelet" />
		<set name="immediate_effect" val="true" />
		<set name="material" val="SILVER" />
		<set name="weight" val="150" />
		<set name="price" val="5400000" />
		<set name="commissionItemType" val="BRACELET" />
		<set name="is_sellable" val="false" />
		<skills>
			<skill id="50192" level="2" /> <!-- Talisman Bracelet Lv. 2 -->
		</skills>
	</item>
	<item id="9591" name="Talisman Bracelet Lv. 3" type="Armor">
		<!-- <font color=bbaa88><Base effect></font>. Talisman slots +4. P. Atk. +50. M. Atk. +50. <font color=bbaa88><Compounding></font>. Materials: Talisman Bracelets and packages of the same level. In case of failure, the current level remains the same, but materials disappear. -->
		<set name="icon" val="icon.dimension_bracelet_i02" />
		<set name="default_action" val="EQUIP" />
		<set name="bodypart" val="rbracelet" />
		<set name="immediate_effect" val="true" />
		<set name="material" val="SILVER" />
		<set name="weight" val="150" />
		<set name="price" val="27000000" />
		<set name="commissionItemType" val="BRACELET" />
		<set name="is_sellable" val="false" />
		<skills>
			<skill id="50192" level="3" /> <!-- Talisman Bracelet Lv. 3 -->
		</skills>
	</item>
</list>