<?xml version="1.0" encoding="UTF-8"?>
<list xmlns:xsi="http://www.w3.org/2001/XMLSchema-instance" xsi:noNamespaceSchemaLocation="../../xsd/items.xsd">
	<item id="1785" name="Soulstone" type="EtcItem">
		<!-- Material required for using certain skills. -->
		<set name="icon" val="icon.etc_crystal_white_i00" />
		<set name="etcitem_type" val="MATERIAL" />
		<set name="immediate_effect" val="true" />
		<set name="material" val="LIQUID" />
		<set name="price" val="250" />
		<set name="commissionItemType" val="OTHER_ITEM" />
		<set name="is_stackable" val="true" />
	</item>
	<item id="1786" name="Recipe: Broadsword" type="EtcItem">
		<!-- For Dwarves only. Recipe for a Broadsword. Requires Create Item Lv. 1. The success rate is 100%. -->
		<set name="icon" val="icon.etc_recipe_white_i00" />
		<set name="default_action" val="RECIPE" />
		<set name="etcitem_type" val="RECIPE" />
		<set name="immediate_effect" val="true" />
		<set name="material" val="LIQUID" />
		<set name="weight" val="30" />
		<set name="price" val="250" />
		<set name="recipe_id" val="2" />
		<set name="is_stackable" val="true" />
		<set name="commissionItemType" val="RECIPE" />
		<set name="handler" val="Recipes" />
	</item>
	<item id="1787" name="Recipe: Willow Staff" type="EtcItem">
		<!-- For Dwarves only. Recipe for a Willow Staff. Requires Create Item Lv. 1 The success rate is 100%. -->
		<set name="icon" val="icon.etc_recipe_white_i00" />
		<set name="default_action" val="RECIPE" />
		<set name="etcitem_type" val="RECIPE" />
		<set name="immediate_effect" val="true" />
		<set name="material" val="LIQUID" />
		<set name="weight" val="30" />
		<set name="price" val="250" />
		<set name="recipe_id" val="3" />
		<set name="is_stackable" val="true" />
		<set name="commissionItemType" val="RECIPE" />
		<set name="handler" val="Recipes" />
	</item>
	<item id="1788" name="Recipe: Bow" type="EtcItem">
		<!-- For Dwarves only. Recipe for a Bow. Requires Create Item Lv. 1. The success rate is 100%. -->
		<set name="icon" val="icon.etc_recipe_white_i00" />
		<set name="default_action" val="RECIPE" />
		<set name="etcitem_type" val="RECIPE" />
		<set name="immediate_effect" val="true" />
		<set name="material" val="LIQUID" />
		<set name="weight" val="30" />
		<set name="price" val="250" />
		<set name="recipe_id" val="4" />
		<set name="is_stackable" val="true" />
		<set name="commissionItemType" val="RECIPE" />
		<set name="handler" val="Recipes" />
	</item>
	<item id="1789" name="Recipe: Cedar Staff" type="EtcItem">
		<!-- For Dwarves only. Recipe for a Cedar Staff. Requires Create Item Lv. 1. The success rate is 100%. -->
		<set name="icon" val="icon.etc_recipe_white_i00" />
		<set name="default_action" val="RECIPE" />
		<set name="etcitem_type" val="RECIPE" />
		<set name="immediate_effect" val="true" />
		<set name="material" val="LIQUID" />
		<set name="weight" val="30" />
		<set name="price" val="1082" />
		<set name="recipe_id" val="5" />
		<set name="is_stackable" val="true" />
		<set name="commissionItemType" val="RECIPE" />
		<set name="handler" val="Recipes" />
	</item>
	<item id="1790" name="Recipe: Dirk" type="EtcItem">
		<!-- For Dwarves only. Recipe for a Dirk. Requires Create Item Lv. 1. The success rate is 100%. -->
		<set name="icon" val="icon.etc_recipe_white_i00" />
		<set name="default_action" val="RECIPE" />
		<set name="etcitem_type" val="RECIPE" />
		<set name="immediate_effect" val="true" />
		<set name="material" val="LIQUID" />
		<set name="weight" val="30" />
		<set name="price" val="1082" />
		<set name="recipe_id" val="6" />
		<set name="is_stackable" val="true" />
		<set name="commissionItemType" val="RECIPE" />
		<set name="handler" val="Recipes" />
	</item>
	<item id="1791" name="Recipe: Brandish" type="EtcItem">
		<!-- For Dwarves only. Recipe for a Brandish. Requires Create Item Lv. 1. The success rate is 100%. -->
		<set name="icon" val="icon.etc_recipe_white_i00" />
		<set name="default_action" val="RECIPE" />
		<set name="etcitem_type" val="RECIPE" />
		<set name="immediate_effect" val="true" />
		<set name="material" val="LIQUID" />
		<set name="weight" val="30" />
		<set name="price" val="1082" />
		<set name="recipe_id" val="7" />
		<set name="is_stackable" val="true" />
		<set name="commissionItemType" val="RECIPE" />
		<set name="handler" val="Recipes" />
	</item>
	<item id="1792" name="Recipe: Short Spear" type="EtcItem">
		<!-- For Dwarves only. Recipe for a Short Spear. Requires Create Item Lv. 1. The success rate is 100%. -->
		<set name="icon" val="icon.etc_recipe_white_i00" />
		<set name="default_action" val="RECIPE" />
		<set name="etcitem_type" val="RECIPE" />
		<set name="immediate_effect" val="true" />
		<set name="material" val="LIQUID" />
		<set name="weight" val="30" />
		<set name="price" val="2720" />
		<set name="recipe_id" val="8" />
		<set name="is_stackable" val="true" />
		<set name="commissionItemType" val="RECIPE" />
		<set name="handler" val="Recipes" />
	</item>
	<item id="1793" name="Recipe: Sword of Reflection" type="EtcItem">
		<!-- For Dwarves only. Recipe for a Sword of Reflection. Requires Create Item Lv. 1. The success rate is 100%. -->
		<set name="icon" val="icon.etc_recipe_white_i00" />
		<set name="default_action" val="RECIPE" />
		<set name="etcitem_type" val="RECIPE" />
		<set name="immediate_effect" val="true" />
		<set name="material" val="LIQUID" />
		<set name="weight" val="30" />
		<set name="price" val="2720" />
		<set name="recipe_id" val="9" />
		<set name="is_stackable" val="true" />
		<set name="commissionItemType" val="RECIPE" />
		<set name="handler" val="Recipes" />
	</item>
	<item id="1794" name="Recipe: Forest Bow" type="EtcItem">
		<!-- For Dwarves only. Recipe for a Forest Bow. Requires Create Item Lv. 1. The success rate is 100%. -->
		<set name="icon" val="icon.etc_recipe_white_i00" />
		<set name="default_action" val="RECIPE" />
		<set name="etcitem_type" val="RECIPE" />
		<set name="immediate_effect" val="true" />
		<set name="material" val="LIQUID" />
		<set name="weight" val="30" />
		<set name="price" val="2720" />
		<set name="recipe_id" val="10" />
		<set name="is_stackable" val="true" />
		<set name="commissionItemType" val="RECIPE" />
		<set name="handler" val="Recipes" />
	</item>
	<item id="1795" name="Recipe: Leather Shoes" type="EtcItem">
		<!-- For Dwarves only. Recipe for Leather Shoes. Requires Create Item Lv. 1. The success rate is 100%. -->
		<set name="icon" val="icon.etc_recipe_white_i00" />
		<set name="default_action" val="RECIPE" />
		<set name="etcitem_type" val="RECIPE" />
		<set name="immediate_effect" val="true" />
		<set name="material" val="LIQUID" />
		<set name="weight" val="30" />
		<set name="price" val="53" />
		<set name="recipe_id" val="11" />
		<set name="is_stackable" val="true" />
		<set name="commissionItemType" val="RECIPE" />
		<set name="handler" val="Recipes" />
	</item>
	<item id="1796" name="Recipe: Leather Tunic" type="EtcItem">
		<!-- For Dwarves only. Recipe for a Leather Tunic. Requires Create Item Lv. 1. The success rate is 100%. -->
		<set name="icon" val="icon.etc_recipe_white_i00" />
		<set name="default_action" val="RECIPE" />
		<set name="etcitem_type" val="RECIPE" />
		<set name="immediate_effect" val="true" />
		<set name="material" val="LIQUID" />
		<set name="weight" val="30" />
		<set name="price" val="159" />
		<set name="recipe_id" val="12" />
		<set name="is_stackable" val="true" />
		<set name="commissionItemType" val="RECIPE" />
		<set name="handler" val="Recipes" />
	</item>
	<item id="1797" name="Recipe: Leather Stockings" type="EtcItem">
		<!-- For Dwarves only. Recipe for Leather Stockings. Requires Create Item Lv. 1. The success rate is 100%. -->
		<set name="icon" val="icon.etc_recipe_white_i00" />
		<set name="default_action" val="RECIPE" />
		<set name="etcitem_type" val="RECIPE" />
		<set name="immediate_effect" val="true" />
		<set name="material" val="LIQUID" />
		<set name="weight" val="30" />
		<set name="price" val="99" />
		<set name="recipe_id" val="13" />
		<set name="is_stackable" val="true" />
		<set name="commissionItemType" val="RECIPE" />
		<set name="handler" val="Recipes" />
	</item>
	<item id="1798" name="Recipe: Leather Helmet" type="EtcItem">
		<!-- For Dwarves only. Recipe for a Leather Helmet. Requires Create Item Lv. 1. The success rate is 100%. -->
		<set name="icon" val="icon.etc_recipe_white_i00" />
		<set name="default_action" val="RECIPE" />
		<set name="etcitem_type" val="RECIPE" />
		<set name="immediate_effect" val="true" />
		<set name="material" val="LIQUID" />
		<set name="weight" val="30" />
		<set name="price" val="204" />
		<set name="recipe_id" val="14" />
		<set name="is_stackable" val="true" />
		<set name="commissionItemType" val="RECIPE" />
		<set name="handler" val="Recipes" />
	</item>
	<item id="1799" name="Recipe: Leather Gloves" type="EtcItem">
		<!-- For Dwarves only. Recipe for Leather Gloves. Requires Create Item Lv. 1. The success rate is 100%. -->
		<set name="icon" val="icon.etc_recipe_white_i00" />
		<set name="default_action" val="RECIPE" />
		<set name="etcitem_type" val="RECIPE" />
		<set name="immediate_effect" val="true" />
		<set name="material" val="LIQUID" />
		<set name="weight" val="30" />
		<set name="price" val="135" />
		<set name="recipe_id" val="15" />
		<set name="is_stackable" val="true" />
		<set name="commissionItemType" val="RECIPE" />
		<set name="handler" val="Recipes" />
	</item>
</list>
