<?xml version="1.0" encoding="UTF-8"?>
<list xmlns:xsi="http://www.w3.org/2001/XMLSchema-instance" xsi:noNamespaceSchemaLocation="../../xsd/items.xsd">
	<item id="500" name="Great Helmet" type="Armor">
		<set name="icon" val="icon.armor_helmet_i00" />
		<set name="default_action" val="EQUIP" />
		<set name="bodypart" val="head" />
		<set name="immediate_effect" val="true" />
		<set name="crystal_count" val="96" />
		<set name="crystal_type" val="C" />
		<set name="material" val="FINE_STEEL" />
		<set name="weight" val="610" />
		<set name="price" val="242000" />
		<set name="commissionItemType" val="HELMET" />
		<set name="enchant_enabled" val="true" />
		<stats>
			<stat type="pDef">51</stat>
		</stats>
	</item>
	<item id="503" name="Zubei's Helmet" type="Armor">
		<!-- Sealed Zubei's Helmet. The seal can be removed by a blacksmith in any village. -->
		<set name="icon" val="icon.armor_helmet_i02" />
		<set name="default_action" val="EQUIP" />
		<set name="bodypart" val="head" />
		<set name="immediate_effect" val="true" />
		<set name="crystal_count" val="96" />
		<set name="crystal_type" val="B" />
		<set name="material" val="MITHRIL" />
		<set name="weight" val="590" />
		<set name="price" val="778000" />
		<set name="commissionItemType" val="HELMET" />
		<set name="enchant_enabled" val="true" />
		<stats>
			<stat type="pDef">62</stat>
		</stats>
	</item>
	<item id="512" name="Dark Crystal Helmet" type="Armor">
		<set name="icon" val="icon.armor_helmet_i00" />
		<set name="default_action" val="EQUIP" />
		<set name="bodypart" val="head" />
		<set name="immediate_effect" val="true" />
		<set name="crystal_count" val="96" />
		<set name="crystal_type" val="A" />
		<set name="material" val="CRYSTAL" />
		<set name="weight" val="570" />
		<set name="price" val="1336000" />
		<set name="enchant_enabled" val="true" />
		<set name="commissionItemType" val="HELMET" />
		<stats>
			<stat type="pDef">69</stat>
		</stats>
	</item>
	<item id="517" name="Compound Helmet" type="Armor">
		<set name="icon" val="icon.armor_leather_helmet_i00" />
		<set name="default_action" val="EQUIP" />
		<set name="bodypart" val="head" />
		<set name="immediate_effect" val="true" />
		<set name="crystal_count" val="147" />
		<set name="crystal_type" val="C" />
		<set name="material" val="FINE_STEEL" />
		<set name="weight" val="610" />
		<set name="price" val="368000" />
		<set name="commissionItemType" val="HELMET" />
		<set name="enchant_enabled" val="true" />
		<stats>
			<stat type="pDef">54</stat>
		</stats>
	</item>
	<item id="547" name="Tallum Helmet" type="Armor">
		<set name="icon" val="icon.armor_helmet_i00" />
		<set name="default_action" val="EQUIP" />
		<set name="bodypart" val="head" />
		<set name="immediate_effect" val="true" />
		<set name="crystal_count" val="147" />
		<set name="crystal_type" val="A" />
		<set name="material" val="CLOTH" />
		<set name="weight" val="570" />
		<set name="price" val="1336000" />
		<set name="enchant_enabled" val="true" />
		<set name="commissionItemType" val="HELMET" />
		<stats>
			<stat type="pDef">69</stat>
		</stats>
	</item>
	<item id="553" name="Iron Boots" type="Armor">
		<set name="icon" val="icon.armor_t10_b_i00" />
		<set name="default_action" val="EQUIP" />
		<set name="bodypart" val="feet" />
		<set name="immediate_effect" val="true" />
		<set name="crystal_count" val="92" />
		<set name="crystal_type" val="D" />
		<set name="material" val="FINE_STEEL" />
		<set name="weight" val="1280" />
		<set name="price" val="50800" />
		<set name="commissionItemType" val="FEET" />
		<set name="isAppearanceable" val="true" />
		<set name="enchant_enabled" val="true" />
		<stats>
			<stat type="pDef">24</stat>
		</stats>
	</item>
	<item id="554" name="Sealed Zubei's Boots" type="Armor">
		<!-- Sealed Zubei's Boots. The seal can be removed by a blacksmith in any village. -->
		<set name="icon" val="icon.armor_t64_b_i02" />
		<set name="default_action" val="EQUIP" />
		<set name="bodypart" val="feet" />
		<set name="immediate_effect" val="true" />
		<set name="crystal_count" val="69" />
		<set name="crystal_type" val="B" />
		<set name="material" val="MITHRIL" />
		<set name="weight" val="1180" />
		<set name="price" val="519000" />
		<set name="enchant_enabled" val="true" />
		<set name="isAppearanceable" val="true" />
		<set name="commissionItemType" val="FEET" />
		<stats>
			<stat type="pDef">41</stat>
		</stats>
	</item>
	<item id="563" name="Dark Crystal Boots" type="Armor">
		<set name="icon" val="icon.armor_t15_b_i00" />
		<set name="default_action" val="EQUIP" />
		<set name="bodypart" val="feet" />
		<set name="immediate_effect" val="true" />
		<set name="crystal_count" val="69" />
		<set name="crystal_type" val="A" />
		<set name="material" val="CRYSTAL" />
		<set name="weight" val="1110" />
		<set name="price" val="890000" />
		<set name="commissionItemType" val="FEET" />
		<set name="isAppearanceable" val="true" />
		<set name="enchant_enabled" val="true" />
		<stats>
			<stat type="pDef">45</stat>
		</stats>
	</item>
	<item id="572" name="Boots of Silence" type="Armor">
		<set name="icon" val="icon.armor_t65_b_i00" />
		<set name="default_action" val="EQUIP" />
		<set name="bodypart" val="feet" />
		<set name="immediate_effect" val="true" />
		<set name="crystal_count" val="69" />
		<set name="crystal_type" val="B" />
		<set name="material" val="DAMASCUS" />
		<set name="weight" val="1190" />
		<set name="price" val="399100" />
		<set name="commissionItemType" val="FEET" />
		<set name="isAppearanceable" val="true" />
		<set name="enchant_enabled" val="true" />
		<stats>
			<stat type="pDef">41</stat>
		</stats>
	</item>
	<item id="582" name="Paradia Boots" type="Armor">
		<set name="icon" val="icon.armor_t68_b_i00" />
		<set name="default_action" val="EQUIP" />
		<set name="bodypart" val="feet" />
		<set name="immediate_effect" val="true" />
		<set name="crystal_count" val="107" />
		<set name="crystal_type" val="B" />
		<set name="material" val="CHRYSOLITE" />
		<set name="weight" val="1140" />
		<set name="price" val="804000" />
		<set name="commissionItemType" val="FEET" />
		<set name="isAppearanceable" val="true" />
		<set name="enchant_enabled" val="true" />
		<stats>
			<stat type="pDef">44</stat>
		</stats>
	</item>
	<item id="583" name="Majestic Boots" type="Armor">
		<set name="icon" val="icon.armor_t45_b_i00" />
		<set name="default_action" val="EQUIP" />
		<set name="bodypart" val="feet" />
		<set name="immediate_effect" val="true" />
		<set name="crystal_count" val="107" />
		<set name="crystal_type" val="A" />
		<set name="material" val="BLOOD_STEEL" />
		<set name="weight" val="1110" />
		<set name="price" val="1355000" />
		<set name="commissionItemType" val="FEET" />
		<set name="isAppearanceable" val="true" />
		<set name="enchant_enabled" val="true" />
		<stats>
			<stat type="pDef">48</stat>
		</stats>
	</item>
	<item id="588" name="Elemental Boots" type="Armor">
		<set name="icon" val="icon.armor_t71_b_i00" />
		<set name="default_action" val="EQUIP" />
		<set name="bodypart" val="feet" />
		<set name="immediate_effect" val="true" />
		<set name="crystal_count" val="107" />
		<set name="crystal_type" val="B" />
		<set name="material" val="MITHRIL" />
		<set name="weight" val="1130" />
		<set name="price" val="804000" />
		<set name="commissionItemType" val="FEET" />
		<set name="isAppearanceable" val="true" />
		<set name="enchant_enabled" val="true" />
		<stats>
			<stat type="pDef">44</stat>
		</stats>
	</item>
	<item id="590" name="Boots of Grace" type="Armor">
		<set name="icon" val="icon.armor_t71_b_i00" />
		<set name="default_action" val="EQUIP" />
		<set name="bodypart" val="feet" />
		<set name="immediate_effect" val="true" />
		<set name="crystal_count" val="107" />
		<set name="crystal_type" val="B" />
		<set name="material" val="MITHRIL" />
		<set name="weight" val="1130" />
		<set name="price" val="804000" />
		<set name="commissionItemType" val="FEET" />
		<set name="isAppearanceable" val="true" />
		<set name="enchant_enabled" val="true" />
		<stats>
			<stat type="pDef">44</stat>
		</stats>
	</item>
	<item id="595" name="Boots of Blessing" type="Armor">
		<set name="icon" val="icon.armor_t56_b_i00" />
		<set name="default_action" val="EQUIP" />
		<set name="bodypart" val="feet" />
		<set name="immediate_effect" val="true" />
		<set name="crystal_count" val="69" />
		<set name="crystal_type" val="B" />
		<set name="material" val="ADAMANTAITE" />
		<set name="weight" val="1160" />
		<set name="price" val="519000" />
		<set name="commissionItemType" val="FEET" />
		<set name="isAppearanceable" val="true" />
		<set name="enchant_enabled" val="true" />
		<stats>
			<stat type="pDef">41</stat>
		</stats>
	</item>
	<item id="598" name="Tallum Boots" type="Armor">
		<set name="icon" val="icon.armor_t45_b_i00" />
		<set name="default_action" val="EQUIP" />
		<set name="bodypart" val="feet" />
		<set name="immediate_effect" val="true" />
		<set name="crystal_count" val="69" />
		<set name="crystal_type" val="A" />
		<set name="material" val="BLOOD_STEEL" />
		<set name="weight" val="1130" />
		<set name="price" val="890000" />
		<set name="commissionItemType" val="FEET" />
		<set name="isAppearanceable" val="true" />
		<set name="enchant_enabled" val="true" />
		<stats>
			<stat type="pDef">45</stat>
		</stats>
	</item>
</list>
